{
  "$schema": "https://json-schema.org/draft/2020-12/schema",
  "$comment": "GENERATED from vocabulary.yaml — do not edit by hand (run: python spec/generate.py). SPDX-License-Identifier: CC-BY-4.0",
  "title": "AAG Action",
  "description": "A single Agent Action Grammar action (AAG 0.7.0).",
  "type": "object",
  "required": [
    "agent_id",
    "task_id",
    "timestamp",
    "step_name",
    "kind"
  ],
  "additionalProperties": false,
  "properties": {
    "agent_id": {
      "type": "string",
      "description": "Stable identifier of the agent performing this action. A task may carry actions from several agents that share memory."
    },
    "task_id": {
      "type": "string",
      "description": "The logical task — one shared-memory scope. Unique per run; groups every action of the task."
    },
    "parent_task_id": {
      "type": "string",
      "description": "The task_id of the task that spawned this one."
    },
    "action_id": {
      "type": "string",
      "description": "Identifier of one action; emitted on an intended record and repeated on the record that settles it (completed or denied)."
    },
    "seq": {
      "type": "integer",
      "minimum": 0,
      "description": "Sequence number within the task. Absent for an intended action; assigned when recorded."
    },
    "timestamp": {
      "type": "string",
      "format": "date-time",
      "description": "When the harness emitted the action (ISO 8601)."
    },
    "step_name": {
      "type": "string",
      "description": "Human-readable label for the action."
    },
    "kind": {
      "type": "string",
      "enum": [
        "task.start",
        "task.end",
        "task.error",
        "task.idle",
        "step.resource",
        "step.message",
        "step.self",
        "step.model",
        "step.credential",
        "step.exec",
        "step.gate",
        "step.unknown"
      ],
      "description": "The action kind; one of `action_kinds`."
    },
    "verb": {
      "type": "string",
      "enum": [
        "GET",
        "POST",
        "PATCH",
        "DELETE"
      ],
      "description": "GET / POST / PATCH / DELETE."
    },
    "aag_version": {
      "type": "string",
      "description": "The AAG version the stream conforms to."
    },
    "properties": {
      "type": "object",
      "description": "Nested contextual object (see `properties`). Open and extensible."
    },
    "input": {
      "type": "object",
      "description": "The arguments to the action, as a JSON object. A native value that is not an object is wrapped under a named key (conventionally `result` for a single value)."
    },
    "output": {
      "type": "object",
      "description": "The result of the action, as a JSON object. For a step, an absent `output` marks an INTENDED action (pre-execution); a present one marks a COMPLETED action. A completed `step.gate` carries its decision as `output.decision` (`pass` or `deny`)."
    },
    "meta": {
      "type": "object",
      "description": "Implementation-defined data about the action (e.g. an evaluator's verdict). It must not change the meaning of the action; consumers accept it and may ignore it, and ignore keys they do not understand. Keys should be namespaced by their writer (e.g. `kyvvu.eval`)."
    }
  },
  "allOf": [
    {
      "if": {
        "properties": {
          "kind": {
            "const": "task.start"
          }
        },
        "required": [
          "kind"
        ]
      },
      "then": {
        "properties": {
          "verb": false
        }
      }
    },
    {
      "if": {
        "properties": {
          "kind": {
            "const": "task.end"
          }
        },
        "required": [
          "kind"
        ]
      },
      "then": {
        "properties": {
          "verb": false
        }
      }
    },
    {
      "if": {
        "properties": {
          "kind": {
            "const": "task.error"
          }
        },
        "required": [
          "kind"
        ]
      },
      "then": {
        "properties": {
          "verb": false
        }
      }
    },
    {
      "if": {
        "properties": {
          "kind": {
            "const": "task.idle"
          }
        },
        "required": [
          "kind"
        ]
      },
      "then": {
        "properties": {
          "verb": false
        }
      }
    },
    {
      "if": {
        "properties": {
          "kind": {
            "const": "step.resource"
          }
        },
        "required": [
          "kind"
        ]
      },
      "then": {
        "required": [
          "verb"
        ],
        "properties": {
          "verb": {
            "enum": [
              "GET",
              "POST",
              "PATCH",
              "DELETE"
            ]
          }
        }
      }
    },
    {
      "if": {
        "properties": {
          "kind": {
            "const": "step.message"
          }
        },
        "required": [
          "kind"
        ]
      },
      "then": {
        "required": [
          "verb"
        ],
        "properties": {
          "verb": {
            "enum": [
              "GET",
              "POST"
            ]
          }
        }
      }
    },
    {
      "if": {
        "properties": {
          "kind": {
            "const": "step.self"
          }
        },
        "required": [
          "kind"
        ]
      },
      "then": {
        "required": [
          "verb"
        ],
        "properties": {
          "verb": {
            "enum": [
              "GET",
              "POST",
              "PATCH",
              "DELETE"
            ]
          }
        }
      }
    },
    {
      "if": {
        "properties": {
          "kind": {
            "const": "step.model"
          }
        },
        "required": [
          "kind"
        ]
      },
      "then": {
        "properties": {
          "verb": false
        }
      }
    },
    {
      "if": {
        "properties": {
          "kind": {
            "const": "step.credential"
          }
        },
        "required": [
          "kind"
        ]
      },
      "then": {
        "required": [
          "verb"
        ],
        "properties": {
          "verb": {
            "enum": [
              "GET",
              "POST",
              "PATCH",
              "DELETE"
            ]
          }
        }
      }
    },
    {
      "if": {
        "properties": {
          "kind": {
            "const": "step.exec"
          }
        },
        "required": [
          "kind"
        ]
      },
      "then": {
        "properties": {
          "verb": false
        }
      }
    },
    {
      "if": {
        "properties": {
          "kind": {
            "const": "step.gate"
          }
        },
        "required": [
          "kind"
        ]
      },
      "then": {
        "properties": {
          "verb": false
        }
      }
    },
    {
      "if": {
        "properties": {
          "kind": {
            "const": "step.unknown"
          }
        },
        "required": [
          "kind"
        ]
      },
      "then": {
        "properties": {
          "verb": false
        }
      }
    },
    {
      "if": {
        "not": {
          "properties": {
            "kind": {
              "const": "task.start"
            }
          }
        }
      },
      "then": {
        "properties": {
          "parent_task_id": false,
          "aag_version": false
        }
      }
    },
    {
      "if": {
        "properties": {
          "kind": {
            "const": "step.gate"
          }
        },
        "required": [
          "kind",
          "output"
        ]
      },
      "then": {
        "properties": {
          "output": {
            "required": [
              "decision"
            ],
            "properties": {
              "decision": {
                "enum": [
                  "pass",
                  "deny"
                ]
              }
            }
          }
        }
      }
    }
  ]
}
