{
  "agent_id": "deploy-agent",
  "task_id": "run-c1a2",
  "seq": 2,
  "timestamp": "2026-07-30T10:00:00Z",
  "step_name": "read_env_secret",
  "kind": "step.credential",
  "verb": "GET",
  "input": { "path": ".env", "key": "STRIPE_API_KEY" },
  "output": { "status": "ok" },
  "properties": { "data": { "classification": "secret" } }
}
