{
  "agent_id": "support-assistant",
  "task_id": "run-9f2ac1",
  "seq": 0,
  "timestamp": "2026-07-30T09:14:20Z",
  "step_name": "handle_support_ticket_4821",
  "kind": "task.start",
  "aag_version": "0.6.0",
  "properties": {
    "agent": {
      "risk_classification": "high",
      "purpose": "answer customer billing questions",
      "environment": "production",
      "version": "2.3.1"
    }
  }
}
